{
  "schema_version": "1.0.0",
  "panel_id": "co2_erf_myhre1998_example",
  "title": "CO2 effective radiative forcing (Myhre 1998) \u2014 EXAMPLE",
  "forcing_type": "ghg",
  "chart_type": "line",
  "analysis_level": "forcing_input",
  "x_axis": {
    "label": "Year",
    "unit": "CE",
    "scale": "linear"
  },
  "y_axis": {
    "label": "ERF",
    "unit": "W m-2",
    "scale": "linear"
  },
  "data": {
    "x": [
      1850,
      1855,
      1860,
      1865,
      1870,
      1875,
      1880,
      1885,
      1890,
      1895,
      1900,
      1905,
      1910,
      1915,
      1920,
      1925,
      1930,
      1935,
      1940,
      1945,
      1950,
      1955,
      1960,
      1965,
      1970,
      1975,
      1980,
      1985,
      1990,
      1995,
      2000,
      2005,
      2010,
      2015,
      2020
    ],
    "y": [
      -0.0524,
      -0.0516,
      -0.0484,
      -0.0422,
      -0.0326,
      -0.0194,
      -0.0022,
      0.019,
      0.0444,
      0.0742,
      0.1084,
      0.1471,
      0.1903,
      0.238,
      0.2903,
      0.3471,
      0.4083,
      0.474,
      0.5439,
      0.6182,
      0.6965,
      0.7788,
      0.8651,
      0.9551,
      1.0487,
      1.1458,
      1.2462,
      1.3497,
      1.4563,
      1.5656,
      1.6777,
      1.7923,
      1.9092,
      2.0283,
      2.1494
    ]
  },
  "meta": {
    "method": "erf_myhre1998",
    "method_version": "0.1.0",
    "author": "ece",
    "generated_at": "2026-09-24T13:28:38.129101+00:00",
    "drs": "input4MIPs.CMIP7.CMIP.CR.CR-CMIP-0-3-0.atmos.mon.co2.gm",
    "mip_era": "CMIP7",
    "production_ready": true,
    "baseline_period": [
      1850,
      1900
    ],
    "params": {
      "species": "co2",
      "formula": "myhre1998"
    },
    "citation": "Myhre, G., et al. (1998). New estimates of radiative forcing due to well mixed greenhouse gases. GRL, 25(14), 2715-2718."
  },
  "status": "published",
  "subtitle": "Illustrative panel for the team meeting, not a real result",
  "comparison_group": "co2_erf_estimates",
  "color_role": "ghg"
}
